{
  "adapter": "hackernews",
  "version": "1.0.0",
  "protocol": "1",
  "run": [
    "node",
    "adapter.ts"
  ],
  "source": {
    "name": "Hacker News",
    "url": "https://news.ycombinator.com"
  },
  "kind": "stream",
  "emits": [
    "post"
  ],
  "reaches": {
    "hosts": [
      "hn.algolia.com"
    ],
    "files": false
  },
  "config": null,
  "channel": "The site, news.ycombinator.com, for every item: one community where any member can reply to any thread.",
  "audiences": [
    "software developers",
    "technical founders and builders"
  ],
  "carries": [
    "building",
    "wanting"
  ],
  "terms": {
    "url": "https://www.ycombinator.com/legal/",
    "read_on": "2026-10-26",
    "licence": "No licence is named for posts. The Terms of Use reserve Y Combinator's rights in the site's content.",
    "attribution": {
      "required": false
    },
    "commercial_use": "forbidden",
    "rate_limit": {
      "requests": 10000,
      "per_seconds": 3600,
      "stated_by": "source"
    },
    "use": "allowed",
    "ruling": {
      "by": "the owner",
      "on": "2026-10-26",
      "says": "The garden reads these threads to learn what people need and to measure its own scoring, not to display, sell or otherwise use the site's content for a commercial purpose. The use is not commercial, so the clause does not apply."
    }
  },
  "access": {
    "method": "none",
    "credentials": [],
    "account": null,
    "automation": "not-stated",
    "obtain": {
      "how": "The search API is open to anyone without an account.",
      "approval": false,
      "cost": "free",
      "status": "ready"
    },
    "scopes": {
      "least": [],
      "read_only": true
    },
    "expiry": null,
    "human_step": null,
    "paid": false
  },
  "private": false,
  "split": {
    "post": {
      "text": "The node's text field, as the API returns it.",
      "url": "The site's item address built from the node's id.",
      "title": "The thread's title, from the root node's title field.",
      "said_at": "The node's created_at field.",
      "handle": "The node's author field, the poster's handle on the site.",
      "parent_address": "The item address of the node's parent_id; the thread's own post has none.",
      "reactions": "The root node's points field, counted at the response's moment; comments carry none."
    }
  }
}
